Date,Title,Link,Tags,Description,Text
2025.01.02 09:52,"Более 1,5 тысячи детенышей родились в Московском зоопарке в 2024 году",https://www.interfax.ru/moscow/1001524,"Москва,Московский зоопарк,Сергей Собянин",,"Москва. 2 января. INTERFAX.RU - Мэр столицы Сергей Собянин сообщил о появлении более 1,5 тысячи детенышей в Московском зоопарке в ушедшем году.,""Московский зоопарк - уютный дом для животных со всего света, в котором дружно живут свыше 10 тысяч постояльцев. Для каждого созданы комфортные условия, максимально приближенные к естественной среде. Даже редкие и уязвимые виды чувствуют себя здесь настолько вольготно, что обзаводятся здоровым и активным потомством. Прошлый, 2024 год, также не стал исключением. В Московском зоопарке появилось на свет свыше 1,5 тысячи детенышей"", - , он в своем личном блоге в четверг.,По его словам, летом ""у самой фотогеничной пары , Кузьмы и Малой родились двое капибарят"".,""Пара , живет в зоопарке более 30 лет - солидный возраст для этих птиц. И тем не менее этой весной они порадовали зоологов, высидев здорового птенца. Дружная стая , пополнилась еще одним неугомонным малышом. Для пары - самца Вицли-Пуцли и самки Фреи - он стал 29 щенком. На ""Турьей горке"" семеро козлят родились в стаде ,. А двое ягнят появились у ,"", - отметил мэр.,Он сообщил, что пара ,поселилась в зоопарке прошлым летом 2023 года, а уже в этом году у них появился щенок. ""Это первые бурые гиены в 160-летней истории Московского зоопарка"", - подчеркнул Собянин.,Кроме того, сказал мэр, в павильоне ""Приматы"" родился детеныш миниатюрной ,, пополнение произошло и в семье ,.,""В филиале Московского зоопарка в Вологодской области - Зоосаде в вотчине Деда Мороза в Великом Устюге появился на свет птенец ,. Летом зоологи радовались пополнению у ,. Этот случай стал одним из первых успешных разведений леопардового полоза из Крымской популяции в условиях зоопарка"", - пояснил Собянин.,""А осенью в террариуме Московского зоопарка появились на свет шесть змеек ,. Это самая крупная змея Австралии и Новой Гвинеи, занесенная в Международную Красную книгу"", - заметил мэр.,Он сообщил, что еще 300 животных переехали в Московский зоопарк из 20 регионов России и десятка других стран. Среди ""новеньких"" - три ,.,""Имена для них уже выбрали на платформе электронного голосования ""Активный гражданин"". Самку, которая прибыла в конце августа, назвали Маша. Еще одна самочка и самец, которых назвали Звездочка и Лучик, приехали в Московский зоопарк в конце декабря"", - уточнил Собянин.,Он рассказал также о двух молодых , - Майе и Базальте, которые приехали из Белоруссии. А также о том, что к самцу ,Диего летом приехала ""подружка"" Белла.,""И впервые за десять лет в Московский зоопарк приехал ,. У головоногого новосела три сердца и аж девять мозгов - он отлично помнит сотрудников, которые за ним ухаживают. Увидеть его можно в павильоне ""Экзотариум"" на Новой территории"", - написал Собянин.,Мэр напомнил, что с прошлого года понаблюдать за животными можно и из дома - Московский зоопарк запустил видеотрансляции из вольеров десяти видов животных, среди которых символ зоопарка манул Тимофей, большие панды Жуи, Катюша и Диндин, карликовый бегемот, капибары, сурикаты, слоны, гориллы, орангутаны, медоеды и рыси."
2025.01.02 10:15,Почти 73 тыс. тонн песка с мазутом вывезено с пляжей Анапы и Темрюкского района Кубани,https://www.interfax.ru/russia/1001525,"Краснодарский край,Анапа",,"По данным оперштаба региона, вывоз песка с мазутом на предприятия утилизации приостановили из-за набранного объема,Москва. 2 января. INTERFAX.RU - Почти 73 тыс. тонн песка с мазутом вывезено с пляжей Анапы и Темрюкского района Кубани после крушения танкеров с нефтепродуктами, сообщает оперштаб региона.,Таковы данные на утро вторника. ""Более половины этого объема приняла площадка временного накопления в хуторе Воскресенском Анапы - 38 тыс. тонн. Всего она сможет принять не менее 200 тыс. тонн загрязненного нефтепродуктами грунта"", - говорится в сообщении штаба.,Отмечается, что предприятия утилизации замазученного песка на данный момент набрали максимальный объем для переработки. Всего такой песок принимают четыре специализированные компании Краснодарского края.,""На предприятия утилизации вывоз временно приостановлен, так как они набрали максимальный объем для переработки. Площадки складирования перед процедурой обеззараживания заполнены, вывозить новые партии смогут после того, как будет частично утилизировано то, что уже размещено на этих предприятиях"", - уточняется в сообщении.,15 декабря в Керченском проливе потерпели крушение танкеры с мазутом ""Волгонефть 212"" и ""Волгонефть 239"". Один член экипажа ,, остальные были эвакуированы. В районе ЧП произошел разлив топлива. Нефтепродукты вынесло на берег, загрязнение растянулось ,.,Общая протяженность зоны мониторинга на побережье Краснодарского края составляет 220 км. К ликвидации ЧС привлечены, с учетом волонтеров, более 10 тыс. человек и 700 единиц техники.,На территории четырех поселений Темрюкского района и в станице Благовещенской близ Анапы был введен режим ЧС.,25 декабря губернатор Краснодарского края Вениамин Кондратьев ввел режим ЧС на всей территории региона. 26 декабря правительственная комиссия под председательством главы МЧС РФ Александра Куренкова приняла решение о введении ,."
2025.01.02 10:54,Оппозиция Южной Кореи потребовала немедленного ареста отстраненного от власти президента,https://www.interfax.ru/world/1001526,"Юн Сок Ёль,Южная Корея",,"Москва. 2 января. INTERFAX.RU - Основная оппозиционная Демократическая партия Южной Кореи призвала немедленно заключить под стражу отстраненного с поста президента Юн Сок Ёля, на арест которого ранее выдали ордер, сообщает в четверг Yonhap.,""На встрече, посвященной политике партии, лидер ее фракции в парламенте Пак Чхан Дэ жестко раскритиковал заявления Юн Сок Ёля и призвал немедленно его арестовать"", - информирует агентство.,""Зачинщик Юн Сок Ёль подстрекает к бунту, прячась в своей резиденции и отказываясь подчиниться законным предписаниям государственных институтов, вместе с тем призывая население сражаться за него"", - заявил председатель политического комитета Джин Сон Чжун, добавив, что арест Юн Сок Ёля является ""ключевым приоритетом"".,Западный окружной суд Сеула во вторник выдал ордер на арест Юн Сок Ёля. Теперь у Управления по расследованию коррупции среди высокопоставленных должностных лиц (CIO), составленному из сотрудников полиции и Минобороны, есть неделя на его исполнение. В CIO отмечали, что могут задействовать полицейские силы, если охрана Юн Сок Ёля помешает взять его под стражу.,Накануне Юн Сок Ёль направил своим сторонникам, собравшимся возле президентской резиденции, письменное послание, в котором пообещал продолжать бороться против антигосударственных сил, которые, по его мнению, представляют угрозу для Южной Кореи. В четверг его юристы обнародовали заявление, согласно которому ордер на арест не имеет законной силы, поскольку CIO не может расследовать обвинения в мятеже. В команде юристов подчеркнули, что если CIO задействуют полицейских против Юн Сок Ёля, то превысит свои полномочия, а охрана Юн Сок Ёля сама может задержать офицеров полиции.,По мнению ряда наблюдателей, если CIO не удастся арестовать Юн Сок Ёля к 6 января, то оно может попробовать вновь вызвать его на допрос. Однако ранее он трижды не являлся на разговор со следователями, что и стало причиной запросить ордер на арест.,В декабре парламент , Юн Сок Ёля от власти после его попытки 3 декабря ввести в стране , для борьбы против политических оппонентов. Это решение вызвало возмущение жителей страны, а парламент быстро , военного положения.,И. о. президента стал Хан Док Су. Позднее южнокорейский парламент также высказался за , от власти Хан Док Су, на этом посту его сменил первый заместитель премьера, министр экономики и финансов Чхве Сан Мок, который заявил, что приоритет его политики - восстановление стабильности в стране.,Конституционный суд должен будет в ближайшие месяцы решить, оставлять ли в силе решение парламента об импичменте президенту. Ранее Чхве Сан Мок утвердил назначение еще двух судей в этот орган, однако требуется заполнить еще одно место, чтобы получить полный состав в девять судей. Для окончательного отстранения от власти Юн Сок Ёля требуются голоса минимум шести судей."
2025.01.02 11:00,Повторный выброс мазута выявлен на побережье Анапы,https://www.interfax.ru/russia/1001527,"Анапа,Краснодарский край,МЧС РФ,Крым",,"По данным МЧС, выброса нефтепродуктов на побережье Крыма не обнаружено,Москва. 2 января. INTERFAX.RU - Авиация МЧС РФ обнаружила в ходе мониторинга выброс нефтепродуктов до трех метров на побережье Анапы, сообщила пресс-служба министерства в четверг.,""В ходе мониторинга на побережье Анапы (,) выявлен выброс нефтепродуктов, частично на участках шириной до 3 метров"", - говорится в сообщении.,По данным пресс-службы, побережье Кубани обследуют 17 мониторинговых групп. Уже собрано и вывезено почти 73 тыс. тонн загрязненного песка и грунта.,Как добавили в ведомстве, ""в Республике Крым по результатам работы 48 мониторинговых групп в ГО Керчь, ГО Феодосия, ГО Судак, ГО Ялта, ГО Алушта и Ленинский район фактов обнаружения нефтепродуктов не выявлено"".,К мониторингу обстановки привлечено более 80 человек и 38 единиц техники.,Всего задействовано порядка 100 человек и 39 единиц техники.,Всего обследовано 1 589 километров береговой линии, собрано и вывезено более 226 тонн загрязненного песка и грунта, очищено более 44 километров береговой линии.,15 декабря в Керченском проливе потерпели крушение танкеры с мазутом ""Волгонефть 212"" и ""Волгонефть 239"". Один член экипажа ,, остальные были эвакуированы. В районе ЧП произошел разлив топлива. Нефтепродукты вынесло на берег, загрязнение растянулось ,.,Общая протяженность зоны мониторинга на побережье Краснодарского края составляет 220 км."
2025.01.02 11:32,"МИД заявил, что остановка Киевом транзита газа РФ ослабила экономический потенциал Европы",https://www.interfax.ru/world/1001529,"газ,Европа,Украина,МИД РФ,Мария Захарова,Газпром,Нафтогаз Украины",,"Москва. 2 января. INTERFAX.RU - Прекращение Украиной транзита российского газа ослабляет экономический потенциал Европы, негативно сказывается на уровне жизни европейцев, заявила официальный представитель МИД России Мария Захарова.,""Прекращение поставок конкурентного и экологически чистого российского энергоносителя не только ослабляет экономический потенциал Европы, но и самым негативным образом сказывается на уровне жизни европейских граждан"", - говорится в , Захаровой, размещенном в четверг на сайте МИД.,По ее словам, ""геополитическая подоплёка решения киевского режима лежит на поверхности. Главный бенефициар передела энергетического рынка Старого Света и он же главный спонсор украинского кризиса - США"".,""Первой жертвой их хищнической стратегии уже стала крупнейшая европейская экономика - ФРГ, которая после подрыва газопроводов ""Северный поток"" и ""Северный поток-2"" оказалась вынуждена закупать природный газ по существенно более высоким ценам и перешла к сворачиванию целого ряда крупнейших и легендарных немецких производств. Теперь свою цену за американское покровительство вынуждены будут заплатить и другие страны в прошлом экономически успешного и независимого Европейского союза"", - указывается в комментарии.,""Ответственность за прекращение поставок российского газа целиком и полностью лежит на США, марионеточном киевском режиме, а также властях европейских государств, пожертвовавших благополучием своих граждан ради финансовой поддержки американской экономики"", - подчеркнула Захарова.,Согласно комментарию, Киев отказался продлевать соглашения ПАО ""Газпром"" с компанией ""Нафтогаз Украины"" и с ""Оператором газотранспортной системы Украины"". Срок действия документов истек 1 января 2025 года. С того же дня был прекращен транзит российского газа в Европу через территорию Украины.,Как говорится в комментарии, ""подчеркнём - киевские власти приняли решение о прекращении прокачки голубого топлива из России для жителей европейских стран, несмотря на выполнение ""Газпромом"" своих контрактных обязательств""."
2025.01.02 11:09,Пассажиропоток авиакомпаний РФ в 2024 году вырос примерно на 5%,https://www.interfax.ru/russia/1001528,"Росавиация,Дмитрий Ядров",,"Москва. 2 января. INTERFAX.RU - Пассажиропоток авиакомпаний РФ в 2024 году, по предварительным данным, вырос примерно на 5% относительно показателя за 2023 год, сообщил глава Росавиации Дмитрий Ядров журналистам в четверг.,""Что касается перевозок в целом по стране, подсчеты на данный момент ведем, но рост составил порядка 5%, и, по предварительным данным, перевезено 111,3 млн человек"", - сказал он.,Объем перевозок через аэропорты Московского авиаузла (""Шереметьево"", ""Внуково"", ""Домодедово""), по его словам, выросли также примерно на 5%, до 75 млн человек. В частности, крупнейший в РФ аэропорт ""Шереметьево"" обслужил ориентировочно на 20% больше пассажиров, чем год назад."
