Date,Title,Link,Tags,Description,Text
2025.01.01 05:45,Новые ставки НДФЛ и налога на прибыль вступили в силу с 1 января,https://www.interfax.ru/business/1001434,"НДФЛ,ЦФА,ФИНВ",,"Москва. 1 января. INTERFAX.RU - Расширенная прогрессивная шкала подоходного налога (НДФЛ) и новая базовая ставка налога на прибыль начинают действовать с 1 января 2025 года.,Для доходов до 2,4 млн руб. в год ставка НДФЛ остается на уровне 13%, для доходов от 2,4 млн до 5 млн руб. - 312 тыс. руб. (уплата налога по ставке 13% с суммы 2,4 млн руб.) и 15% в части превышения 2,4 млн руб.; для доходов от 5 млн до 20 млн руб. - 702 тыс. руб. и 18% от превышения 5 млн руб.; для доходов от 20 млн до 50 млн руб. - 3,402 млн руб. и 20% от превышения 20 млн руб.; более 50 млн руб. - 9,402 млн руб. и 22% в части превышения порога дохода.,От повышенного НДФЛ освобождены надбавки к зарплате для работников районов Крайнего Севера и приравненных к ним местностей с неблагоприятными условиями.,При этом предусмотрен возврат налога для родителей с двумя и более детьми, среднедушевой доход на члена семьи которых не превышает 1,5-кратного прожиточного минимума в месяц. Такие налогоплательщики смогут возвращать уплаченный НДФЛ в размере 7%, таким образом, ставка налога для них фактически составит 6%.,Помимо этого, в части НДФЛ выравниваются налоговые условия для операций с цифровыми финансовыми активами (ЦФА) с операциями с ценными бумагами - ставки устанавливаются не выше 15%. А также устанавливается единый размер фиксированного НДФЛ для владельцев пяти и более контролируемых иностранных компаний в сумме 25 млн руб.,Прогрессивная шкала НДФЛ, по оценкам, в 2025 г. обеспечит 533 млрд руб. дополнительных доходов, а в 2025-2027 гг. с учетом изменения параметров стандартных налоговых вычетов - 1,4 трлн руб.,Повышение базовой ставки налога на прибыль с 20% до 25% даст в бюджетную систему в 2025 году дополнительно 1,6 трлн руб., а за 2025-2027 гг. - порядка 5 трлн руб. Одновременно с повышением ставки вводится федеральный инвестиционный налоговый вычет (ФИНВ). Он не может превышать 50% от суммы расходов на первоначальную стоимость основного средства или амортизируемого нематериального актива. Его не имеют права применять: иностранные организации, признаваемые налоговыми резидентами РФ; участники СЗПК; банки; организации, осуществляющие производство подакцизных товаров. Установлен закрытый перечень подакцизных товаров, при производстве которых нельзя будет использовать ФИВН: производство этилового спирта, спиртосодержащей продукции, лекарственных средств, спиртосодержащей продукции бытовой химии и парфюмерии, некоторых типов алкогольной продукции, это также табачная продукция, жидкости для электронных систем доставки никотина, производство сахаросодержащих напитков.,Применять вычет смогут компании, работающие в пяти направлениях ОКВЭД: добыча полезных ископаемых; обрабатывающие производства; обеспечение электрической энергией, газом и паром, а также кондиционирование воздуха; деятельность гостиниц и предприятий общественного питания; научные исследования и разработки. Право на применение инвествычета предоставляется при вложениях в ""машины и оборудование, включая хозяйственный инвентарь"", а также ""исключительные права на изобретение, полезную модель или промышленный образец"". Годовой лимит бюджетных средств на предоставление компаниям вычета составляет 150 млрд руб.,При продаже или ином выбытии основных средств или нематериальных активов ранее чем по истечении пяти лет с момента ввода его в эксплуатацию нужно будет восстановить налог, который не был уплачен из-за вычета. Исключение - случаи, когда выбытие объекта осуществлено после истечения срока его полезного использования."
2025.01.01 06:20,Председательство в ЕАЭС перешло к Белоруссии,https://www.interfax.ru/world/1001435,"Белоруссия,ЕАЭС,председательтсво",,"Москва. 1 января. INTERFAX.RU - Председательство в Евразийском экономическом союзе (ЕАЭС) перешло к Белоруссии с 1 января 2025 года.,Белоруссия в течение следующего года будет председательствовать в органах ЕАЭС: Высшем Евразийском экономическом совете, Евразийском межправительственном совете и Совете Евразийской экономической комиссии.,В рамках председательства запланировано проведение в Минске заседания Высшего Евразийского экономического совета, Евразийского экономического форума, заседания Евразийского межправительственного совета и ряда других мероприятий ЕАЭС.,Приоритетные направления председательства Белоруссии в ЕАЭС будут обозначены в ближайшее время в обращении президента республики, председателя Высшего Евразийского экономического совета Александра Лукашенко к главам государств-членов союза."
2025.01.01 08:26,"""Газпром"" завершил подачу газа для транзита через Украину",https://www.interfax.ru/world/1001438,"Газпром,Украина,транзит",,"Москва. 1 января. INTERFAX.RU - Подача российского газа для транзита в Европу через Украину завершилась по истечении транзитного контракта с Киевом, сообщил , .,""Газпром"" лишен технической и юридической возможности подавать газ для транзита через Украину"", - говорится в ,.,В ""Газпроме"" напомнили: ""1 января 2025 года в 8:00 МСК завершился срок действия подписанных 30 декабря 2019 года документов: соглашения между ПАО ""Газпром"" и НАК ""Нафтогаз Украины"" на организацию транспортировки российского газа через территорию Украины и соглашения о взаимодействии между операторами ГТС России и Украины - ПАО ""Газпром"" и ООО ""Оператор газотранспортной системы Украины"". В связи с неоднократно и явно выраженным отказом украинской стороны продлевать данные соглашения ""Газпром"" был лишен технической и юридической возможности подавать с 1 января 2025 года газ для транзита через территорию Украины"".,Украинские транзитные мощности также не были выставлены на аукционы бронирования, как это заведено на европейском газовом рынке.,""С 8:00 МСК подача российского газа для его транспортировки через территорию Украины не осуществляется"", - констатирует компания.,С учетом форс-мажора, объявленного украинской стороной по одному из транзитных маршрутов, с мая 2022 года через Украину могло прокачиваться до 42,4 млн куб. м в сутки - около 15 млрд куб. м в год.,Среди потребителей российского топлива на этом направлении незадолго до конца 2024 года Австрия отказалась от продолжения получения газа из РФ и обострила ситуацию в арбитраже. Словакия выступила за продолжение поставок.,Еще одним получателем российского топлива через Украину является Молдавия. Республика в 2021 году договорилась с ""Газпромом"" об аудите исторического долга Кишинева за газ. Затянутый долговой вопрос дает ""Газпрому"" право в любой момент прекратить поставки газа. Молдавия нашла консультантов, которые поставили под сомнение $709 млн долга, а чиновники страны выразили готовность оплатить лишь $9 млн.,В ноябре 2024 года министр энергетики Молдавии Виктор Парликов приезжал в Санкт-Петербург к главе ""Газпрома"" Алексею Миллеру. В сообщении концерна по итогам встречи отмечалось, что на ней обсуждались как ""варианты организации поставок"", так и долг. В связи с отказом Кишинева урегулировать долг ""Газпром"" уведомил ""Молдовагаз"", что за нарушение платежных обязательств с 8:00 МСК 1 января 2025 года вводит ограничение поставок природного газа в Молдавию до 0 куб. м в сутки."
2025.01.01 11:27,Изменились нормы по нацрежиму при закупке госзаказчиками импортной продукции,https://www.interfax.ru/russia/1001459,"Алексей Лавров,Минфин,ЕАЭС,Татьяна Демидова,правительство",,"Москва. 1 января. INTERFAX.RU - Вступило в силу правительственное постановление №1875, которым теперь регламентируется применение национального режима и изъятий из него при закупках госзаказчиками и госкомпаниями отдельных видов товаров иностранного производства.,Базовые положения нового правпостановления устанавливают запрет на закупку госзаказчиками и госкомпаниями 151 вида импортных товаров (в том числе поставляемых при выполнении закупаемых работ или при оказании закупаемых услуг), вводят ограничения на закупку 465 видов продукции и устанавливают 15%-е ценовое преимущество в отношении товаров российского происхождения.,При этом оговаривается, что эти нормы применяются также в случае лизинга соответствующих видов продукции и не применяются, когда предполагается заключение контракта со встречными инвестиционными обязательствами (офсетный контракт).,Также госкомпании могут не применять эти нормы в случае закупки товаров, работ, услуг, необходимых для выполнения гособоронзаказа, для функционирования критической информационной инфраструктуры, для реализации проекта технологического суверенитета, для использования в сфере атомной энергетики.,Кроме того, этим постановлением для госкомпаний установлена минимальная обязательная доля закупок товаров российского происхождения. Эта норма действует в отношении 277 видов товаров. Здесь, в свою очередь, оговаривается, что это положение не действует в отношении госкомпаний, включенных в сводный реестр предприятий ОПК, и госкомпаний, являющихся субъектами естественных монополий или осуществляющих регулируемые виды деятельности.,Этим документом правительство отменило действие более 60 подзаконных актов или их отдельных положений, которые до 1 января определяли порядок применения запретов и ограничений на закупку отдельных видов импортных товаров, а также предоставления преференций товарам российского или евразийского производства.,Летом 2024 года, закупочного законодательства, регламентирующих вопросы импортозамещения (318-ФЗ). Он направлен на регулирование вопросов предоставления национального режима и унификацию правил осуществления закупок при предоставлении национального режима (понятие ""нацрежим"" предусматривает распространение на зарубежные товары тех же правил и требований, которые действуют в отношении аналогичной российской продукции) при госзакупках и закупках госкомпаний.,""Законопроект направлен на упрощение и повышение эффективности импортозамещения при госзакупках (регулируются законом ""О контрактной системе"", 44-ФЗ) и закупках госкомпаний (закон ""О закупках товаров, работ, услуг отдельными видами юридических лиц"", 223-ФЗ), - объяснял необходимость предлагаемых изменений заместитель министра финансов Алексей Лавров на стадии обсуждения документа в Думе. - Он предусматривает четыре основных новации, три из которых касаются 44-ФЗ, а одна - 223-ФЗ"".,Сам документ наделил правительство полномочиями на установление изъятий из национального режима в определенных случаях и дает кабинету министров право предоставлять преференции при закупках российских товаров или товаров из стран ЕАЭС, если на торгах они конкурируют с иностранными.,Также этим законом введено единое правило ""второй лишний"" (,) вместо действующего ранее менее жесткого правила ""третий лишний"".,Помимо этого, документ распространяет положение о предоставлении 15%-й ценовой преференции на все российские товары. Ранее эта норма действовала лишь в отношении соответствующего перечня продукции.,Также правительство получило право устанавливать особенности определения начальной (максимальной) цены контракта в отношении российских товаров, работ, услуг, при закупках которых будут действовать запрет, ограничение ,) или преимущество (,), предусмотренное закупочным законодательством. Эта норма распространяется также на контракты с единственным поставщиком.,Помимо этого, принятый закон позволяет не применять нормы о нацрежиме при проведении закупок органами СВР и ФСБ России (если закупаемые товары, работы, услуги необходимы для обеспечения безопасности государства), а также ФСО России (для госохраны) и Росгвардией (для борьбы с терроризмом и экстремизмом, обеспечения безопасности высших должностных лиц регионов).,""Наша задача - настроить механизм импортозамещения при осуществлении закупок таким образом, чтобы он срабатывал, позволяя по максимуму закупать товары российского производства, - говорила,директор департамента бюджетной политики в сфере контрактной системы Минфина Татьяна Демидова. - При этом сам механизм меняется в сторону большего правового урегулирования, чтобы максимально гарантировать приобретение товаров российского производства"".,Демидова подчеркивала, что все эти меры обусловлены не просто перечнем товаров, а учитывают наличие фактического их производства и его объема, позволяющего обеспечить потребность заказчиков в таких товарах.,""То есть чтобы самим себе не навредить, не лишить заказчиков соответствующих товаров, работ, услуг и не блокировать их деятельность вследствие невозможности реализации функций по причине отсутствия российских товаров"", - говорила она.,По данным Минфина, объем закупок госзаказчиками и госкомпаниями товаров российского производства составил в 2023 году 9,9 трлн рублей (общий объем всех закупок госзаказчиками и госкомпаниями Федеральное казначейство оценивало в 32 трлн рублей). При этом госзаказчики закупили товары на 3,4 трлн рублей, на долю товаров российского производства пришлось 2,3 трлн. Госкомпании в 2023 году заплатили за товары 8,9 трлн рублей, объем закупок товаров именно российского производства составил 7,6 трлн рублей (85% от общего объема закупок товаров) против 4 трлн в 2022 году (87%)."
2025.01.01 11:29,В Севастополе остановлен морской пассажирский транспорт,https://www.interfax.ru/russia/1001460,Севастополь,,"Москва. 1 января. INTERFAX.RU - В Севастополе приостановлено движение морского пассажирского транспорта, сообщает телеграм-канал дирекции по развитию дорожно-транспортной инфраструктуры города.,Причины приостановки не уточняются."
